{
  "id": "codigo",
  "orden": 3,
  "caras": { "frente": "cod-f", "reverso": "cod-r" },
  "fondo": { "frente": "crema", "reverso": "gingham" },
  "archivo": "code-cat",
  "controles": ["textos", "arte", "fondo", "acento", "rotSt", "rotTit", "brillitos", "washi", "escala"],
  "verificar": ["qr", "contacto", "max_fuentes"]
}
