{
  "id": "socks",
  "orden": 4,
  "caras": { "frente": "soc-f", "reverso": "soc-r" },
  "fondo": { "frente": "algodon", "reverso": "cuaderno" },
  "archivo": "programming-socks",
  "controles": ["textos", "arte", "fondo", "acento", "rotSt", "rotTit", "brillitos", "washi", "lazo", "escala"],
  "qr": ["actual", "iguales"],
  "verificar": ["qr", "contacto", "max_fuentes"]
}
